id,created_utc,author,title,selftext,permalink,score,num_comments,flair_text
1n1tw1e,1756330482.0,Away-Huckleberry9967,"Gibt's im Kreis Lubu oder Stuttgart noch Läden, in denen man Elektrobauteile kaufen kann?",,https://www.reddit.com/r/stuttgart/comments/1n1tw1e/gibts_im_kreis_lubu_oder_stuttgart_noch_läden_in/,16,10,Looking for...
1n1rwoa,1756325850.0,Syncratix22,Wasen Festzelte Abendkasse,"Hallo zusammen,
ich wollte aus gegebenem Anlass mal nachfragen, wie es bei den Festzelten auf dem Wasen generell so mit Abendkasse aussieht.
Wir würden vom Datum her eher spontan hingehen und sind auch keine 10er Gruppe, die man zum Reservieren ja meist braucht.
Können wir uns an einem Freitag oder Samstag darauf verlassen, noch in ein Zelt zu kommen, wenn man rechtzeitig da ist?
Besten Dank",https://www.reddit.com/r/stuttgart/comments/1n1rwoa/wasen_festzelte_abendkasse/,1,3,Frage / Advice
1n1okk3,1756318283.0,kleiner_unhold,Riechkräuter kaufen in Stuttgart,"Hi, weiß jemand ob man solche Riechkräuterdosen oder die Riechstifte irgendwo in Stuttgart kaufen kann ? Vielleicht hat sie schonmal jemand bei goasia oder sonstigem Asia Shop gesehen ?",https://www.reddit.com/r/stuttgart/comments/1n1okk3/riechkräuter_kaufen_in_stuttgart/,10,7,Looking for...
1n1hqnc,1756302944.0,FH2206,Rentner und die Uhrzeit,"Was ist hier in letzter Zeit los?
Innerhalb von 2 Tagen von 5 unterschiedlichen älteren Personen un der Innenstadt nach der Uhrzeit gefragt worden. Was häufiger ist als in den letzten Jahren zusammen....

",https://www.reddit.com/r/stuttgart/comments/1n1hqnc/rentner_und_die_uhrzeit/,0,7,Frage / Advice
1n1f9g9,1756296593.0,BenjiclesGirl,Möbel und Kleidung zu verschenken/Clothes and furniture to give away,"Hallo! Ich ziehe Ende nächsten Monats aus Stuttgart weg und habe ein paar sperrige Möbelstücke (ein paar Sofas, eine Matratze und ein Bettgestell (200x160)) sowie ein paar Kisten mit Kleidung abzugeben. (Damen S/M, Herren M/L.)

Ich möchte sie gerne jemandem geben, der sie braucht. Wenn ihr also jemanden kennt oder eine Organisation kennt, die sie braucht, lasst es mich bitte wissen.

Mein Deutsch ist nicht so gut, daher benutze ich einen Übersetzer, füge meinen Text unten aber auch auf Englisch ein. Vielen Dank!

\-----

Hello! I am moving away from Stuttgart at the end of next month and have a few bulky pieces of furniture (a few couch pieces, a mattress, and bed frame (200x160)) to give away, as well as a few boxes of clothes. (Woman's S/M, Men's M/L)

I would like to give them to someone who needs them, so if you know someone, or know an organization that would want them, let me know, please.

Edit: there is also a white adult tricycle that I'm unable to take with me. The brakes are weird but it could be fun for someone to play with.",https://www.reddit.com/r/stuttgart/comments/1n1f9g9/möbel_und_kleidung_zu_verschenkenclothes_and/,10,11,Frage / Advice
1n1ef3i,1756294063.0,Fast-Bar-3349,Bar/Pub to watch the Champions League games,Any great bar/pub that broadcasts todays Champions League games? Specifically Benfica-Fenerbahce would be great. Thank you in advance!,https://www.reddit.com/r/stuttgart/comments/1n1ef3i/barpub_to_watch_the_champions_league_games/,2,3,Looking for...
1n1djei,1756291207.0,Peter_Maffayson,Station Neckarpark entfällt?,"Hey zusammen,
ich will am Samstag ins Stadion zum Bundesligaspiel gegen Gladbach. Ich hatte ursprünglich vor in Obertürkheim am P+R zu parken und dann mit der S-Bahn(S1) zum Neckarpark zu fahren. 
Als ich aber in der DB-App bzw. auch Google Maps nachgeschaut habe, wird mir ausgerechnet an diesem Tag keine Direktverbindung von den Stationen angezeigt. An allen anderen Tagen gibt es ja normalerweise eine 5min Direktverbindung.

Weiß jemand dazu mehr? Wird an Spieltagen trotzdem am Neckarpark eine Bahn halten oder fällt die tatsächlich aus?
Falls ja: hat jemand ähnliche P+R Alternativen?

Danke schonmal🙏",https://www.reddit.com/r/stuttgart/comments/1n1djei/station_neckarpark_entfällt/,5,8,Frage / Advice
1n19zur,1756277670.0,Luc1fer00,Autowäsche,"Hey Leute,
ich suche eine Autowäsche, die mein Auto nicht nur innen, sondern auch außen richtig sauber macht — also ein echtes Rundum-sorglos-Paket!
Wichtig: Außen soll das mit der Hand gewaschen werden, diese Maschinen bringen’s nicht, machen oft Kratzer.
Hat jemand einen guten Tipp, wo mein Auto richtig schön glänzen kann? Ich hab keine Lust, selbst den Schwamm zu schwingen.

Danke schon mal, mein Auto und ich freuen uns! 🚗✨
",https://www.reddit.com/r/stuttgart/comments/1n19zur/autowäsche/,4,9,Looking for...
1n0vz7z,1756237974.0,ApprehensiveDog2790,Leerstände im Milaneo,"Ich war heute zum ersten Mal seit längerer Zeit und bin ziemlich erschrocken über die Zahl der Leerstände im Milaneo. Relative viele Ladenfronten verklebt mit Infos, welche tollen Läden da demnächst aufmachen. 

Im Media Markt ein Bild des Jammers: Viele freie Flächen, man hat sich sichtlich bemüht die wenigen Geräte so über den Laden zu verteilen, dass er halbwegs voll wirkt. Kein Vergleich zum Saturn in den Königsbau Passagen.

Auch relativ wenig Besucher für unter der Woche zwischen 16 und 18 Uhr. Gefühlt hauptsächlich Teenager beim Shoppen. Die meisten Essensstände ziemlich leer, mit Ausnahmen (KFC war recht überlaufen).

Bisher habe ich nur das Gerber als Problemfall gesehen und die Königsbau Passagen hatten nach Corona ab Ebene Food Lounge auch immer wieder mit Leerständen zu kämpfen. Aber das Milaneo kenne ich nur in proppenvoll mit vielen Läden.

Was ist da los? ",https://www.reddit.com/r/stuttgart/comments/1n0vz7z/leerstände_im_milaneo/,111,78,Diskussion
1n0tuvx,1756233084.0,Annual-Grass-8347,Daytrip,"Moin ich will gerne mit meiner Freundin ein tagestrip nach stutti machen.

Was könnt ihr empfehlen wir lieben ins Museum zu gehen. Bisschen Kultur schöne Architektur und japanisches Essen.

Wenn ihr paar romantische Spots kennt gerne mitteilen 

Lg ",https://www.reddit.com/r/stuttgart/comments/1n0tuvx/daytrip/,0,14,Frage / Advice
1n0s1n4,1756229013.0,melviss13,Suche Videograph (Student) Stuttgart,"Hi, 
ich bin auf der Suche nach einem Videograph in Stuttgart und Umgebung, der mein Rap Video drehen und schneiden kann. Budget liegt bei ca 200-300 €.",https://www.reddit.com/r/stuttgart/comments/1n0s1n4/suche_videograph_student_stuttgart/,3,1,Looking for...
1n0g5bx,1756196442.0,Important-Term8852,Restaurant mit Michelinstern und vegetarischen Optionen,"Hallo zusammen, 
Kennt ihr in Stuttgart ein Restaurant, welches einen Michelinstern hat (oder auch mehrere) und sowohl ein Menü mit Fleisch als auch eine vegetarische Option anbietet?",https://www.reddit.com/r/stuttgart/comments/1n0g5bx/restaurant_mit_michelinstern_und_vegetarischen/,0,14,Looking for...
1n0fvn6,1756195346.0,basteyyyy,Döner,"Hey Freunde, kennt jemand noch einen Döner in Stuttgart oder Umgebung der wie früher Dreiecks Brot hat welches unter nem Kontaktgrill knusprig gemacht wird ? Gefühlt macht jeder Döner mittlerweile sein Brot selber  oder verkauft dieses 0815 Fladenbrot. Vielen dank schon mal. 

Meine Lieblingsdöner sind übrigens Etye in Canstatt und Dilgelay am Stöckach.",https://www.reddit.com/r/stuttgart/comments/1n0fvn6/döner/,8,11,Frage / Advice
1n0crrw,1756183618.0,Tricky_Ad3938,flat search websites,"Hi All, what are the best websites to look for a flat (for a <6months short stay) ? Danke !",https://www.reddit.com/r/stuttgart/comments/1n0crrw/flat_search_websites/,0,1,Looking for...
1n07egl,1756167763.0,PrestigiousJunket169,First time in Stuttgart,"Hi everyone, my girlfriend (F20) and I (M20) are in Stuttgart for the next couple of days and are mainly looking for good bars to drink. One of my bucket list items is to drink a stein (hoping that is the right word, litre of beer anyway) in germany. We have had a walk around today but very blindly and could not find anywhere serving them. Hopefully someone has some tips or ideas! If not anything beer/alcohol related will do 😂.

Thank you!

EDIT: Realised I’ve been using the wrong word for some reason or another, whoops.",https://www.reddit.com/r/stuttgart/comments/1n07egl/first_time_in_stuttgart/,16,34,Looking for...
1n02b3x,1756155117.0,Dr1zz3l,Was ist dieser Lichtstreifen im Himmel?,"Dieses Lichtband lief gerade mit etwas Abstand hinter drei Satelliten über unseren Himmel. West nach Ost, ca 10-15 Grad lang. Weiß jemand, was das war?",https://www.reddit.com/r/stuttgart/comments/1n02b3x/was_ist_dieser_lichtstreifen_im_himmel/,52,17,Sonstiges
1mzwdw4,1756141795.0,ipreferwine456,Brilliant piece of Swabian engineering in order to keep your dog safe,Greetings from S-Mitte.,https://www.reddit.com/r/stuttgart/comments/1mzwdw4/brilliant_piece_of_swabian_engineering_in_order/,184,2,Sonstiges
1mzl170,1756111024.0,BusinessBirbs,Hermann Miller Stuhl Probesitzen?,"Hallo liebe Schwarmintelligenz,

weiß jemand, ob es einen Büroausstatter im Stuttgarter Raum gibt, bei dem man Hermann Miller Stühle probesitzen kann? Man findet absolut gar nix in der Google Recherche, wäre sehr dankbar für ein paar Tipps. ",https://www.reddit.com/r/stuttgart/comments/1mzl170/hermann_miller_stuhl_probesitzen/,5,7,Looking for...
1mz221k,1756057138.0,LarryLaBeau,Flammende Sterne außerhalb des Festgeländes?,"Ich frage mich, ob hier ""hinter"" dem Feuerwerk eine gute Perspektive ist? Gehört dieser Weg noch zum abgesperrten Bereich? https://maps.app.goo.gl/T9bUJTCoN4zSNoBh6

Gerne Alternativvorschläge. Vielen Dank :)",https://www.reddit.com/r/stuttgart/comments/1mz221k/flammende_sterne_außerhalb_des_festgeländes/,1,4,Frage / Advice
1myzn3x,1756051723.0,Away-Huckleberry9967,Magischer Ort in Skyrim? Oder Grüner Heiner mit Windrad in der 3D-Ansicht von Apple Maps.,,https://www.reddit.com/r/stuttgart/comments/1myzn3x/magischer_ort_in_skyrim_oder_grüner_heiner_mit/,55,8,Sonstiges
1myyr7n,1756049705.0,ich_brauchmemes,Erfahrungen mit einem Anglistik Studium an der Uni Stuttgart?,"Hallo zusammen!

Ich stehe kurz vor dem Studium und bin noch hin- und hergerissen, was ich denn studieren möchte. Zum Glück habe ich das inzwischen auf 2 Optionen eingegrenzt und eine davon wäre ein Anglistik Studium an der Uni in Stuttgart.

Mich verwirren nur die Anforderungen auf der Website des Studienganges, denn da wird eine zweite Fremdsprache, am besten Latein, Russisch oder eine romanische Sprache, vorgeschrieben. Ich habe zwar ein B2 Niveau in Spanisch vom Abi noch, bin aber nicht wirklich ein Experte darin, weil wir damals sehr sehr viel Stundenausfall in dem Fach hatten.

Am komischsten ist für mich aber, dass überhaupt eine Sprache neben Englisch verlangt wird. Ein Freund studiert so ziemlich das gleiche, zwar mit anderem Studiengangsnamen aber selbem Inhalt, in Rheinland-Pfalz und da war nichts außer Englisch gefragt.

Also ja, hat jemand Erfahrung mit Anglistik an der Uni Stuttgart? Braucht man wirklich aktiv eine zweite Fremdsprache im Studium oder ist das eher pro forma? Danke im Voraus!",https://www.reddit.com/r/stuttgart/comments/1myyr7n/erfahrungen_mit_einem_anglistik_studium_an_der/,1,8,Frage / Advice
1myxr8y,1756047418.0,0g3l,Wo einen späten Abend/Frühe Nacht in nähe HBF verbringen?,"Moin!
Mein Zug fährt in der Nacht zu morgen gegen 0230 aus Stuttgart HBF ab, ich muss bis dahin n paar Stunden überbrücken.
Gibt es nette, ruhige Orte halbwegs in der Nähe bis BHF die entsprechend lange geöffnet sind und bei denen man sich n paar Stunden hinpflanzen kann? Muss nicht kostenlos sein, günstig wär natürlich n Bonus.
Danke für eure Ideen!",https://www.reddit.com/r/stuttgart/comments/1myxr8y/wo_einen_späten_abendfrühe_nacht_in_nähe_hbf/,12,25,Frage / Advice
1myxlpf,1756047055.0,Ok-Author-8439,Fikstionsbescheinigung,Can I go back to the Philippines and come back to Germany with only Fikstionsbescheinigung? ,https://www.reddit.com/r/stuttgart/comments/1myxlpf/fikstionsbescheinigung/,0,2,Diskussion
1myuj2d,1756039236.0,gdrhr,Found grey iPad in Schafhausen today,"I was riding my bike on this Sunday and almost fell over this iPad in Schafhausen (yes, not at all Stuttgart, scusi) that was laying flat on the road. I took it with me as I could not find anyone around.

If you believe this is yours, send me some clues via private message in order to identify it so we find a way that you can pick it up. 

Cheers",https://www.reddit.com/r/stuttgart/comments/1myuj2d/found_grey_ipad_in_schafhausen_today/,42,6,Sonstiges
1myqkyj,1756025702.0,Dependent_Loan4235,"Stuttgart West, 6 Monate lang","Das Bild habe ich 6 Monate lang über Stuttgart West aufgenommen. Man kann leider nicht viel von der Stadt erkennen, weil die Belichtungszeit so lange und das Fotopapier sehr klein ist. Das Bild wurde mit einer kleinen Lochkamera aufgenommen die ich in der Galerie “The 7th Day” in Stuttgart West gekauft habe. Leider existiert diese nicht mehr. Kennt diese einer von euch? Die Webseite ist noch da und glaube ich mache eine zweite Aufnahme 
",https://www.reddit.com/r/stuttgart/comments/1myqkyj/stuttgart_west_6_monate_lang/,221,17,Frage / Advice
1mybbxj,1755979001.0,UnsureAndUnqualified,Bester Imbiss am Ende eines Trinkabends?,"Moin Länd (ich oute mich mal direkt als Tourist),

wir trinken uns gerade unter den Tisch und bejammern, dass die Fritty Bar nicht mehr existiert. Wo können wir denn gleich den Abend noch mit gutem fettigen Essen abrunden? Wir kommen gleich noch am Weinfest vorbei, also wäre die Region der Innenstadt super!",https://www.reddit.com/r/stuttgart/comments/1mybbxj/bester_imbiss_am_ende_eines_trinkabends/,24,29,Looking for...
1myalnl,1755977273.0,Whole-Description637,Billig B196,"Kennt jemand Angebote oder gute Preise für den B196 in und um Stuttgart? Ich habe Angebote bis zu 770 € gefunden. Weiß jemand von besseren Preisen? 
Vielen Dank !",https://www.reddit.com/r/stuttgart/comments/1myalnl/billig_b196/,5,1,Frage / Advice
1my9wg3,1755975615.0,Whole-Description637,Klasse A Führerschein auf Englisch,"Hallo zusammen,
Ich bin auf der Suche nach einer Fahrschule, um meinen A-Führerschein zu machen (den B-Führerschein habe ich schon seit mehr als zehn Jahren). Ich spreche immer noch nicht gut genug Deutsch, um Fahrstunden zu nehmen, also suchte ich eine Fahrschule, die auch Unterricht und Unterstützung auf Englisch anbietet. 
Haben Sie irgendwelche Erfahrungen oder Ratschläge? 
Vielen Dank !",https://www.reddit.com/r/stuttgart/comments/1my9wg3/klasse_a_führerschein_auf_englisch/,0,1,Frage / Advice
1my11y1,1755954593.0,Pr1nceRedd1t,Flammende Sterne ohne Ticket,Wo kann ich das Feuerwerk am besten von außerhalb beobachten? Oder ist ein 25€ Ticket zwingend notwendig um gute Sicht zu haben?,https://www.reddit.com/r/stuttgart/comments/1my11y1/flammende_sterne_ohne_ticket/,1,2,Events
1my0q49,1755953718.0,Ok_University5811,Moving to Stuttgart,"Hi,

i am going to move Stuttgart at the end of august to work as a diplomat.
What are the most importat things to do first?",https://www.reddit.com/r/stuttgart/comments/1my0q49/moving_to_stuttgart/,2,12,Diskussion
1mxyyrj,1755948493.0,Conscious_You_6466,Living with Expired Visa,"Hey everyone

I hope you guys are doing ok. I am reaching out to the community here with a very serious problem and i hope someone will be able to give me some directions or advices :( 

I came to stuttgart last year in June. My initial visa was one year long. Now, my visa has been expired in june and despite multiple emails, calls to auslanderbehorde, they have not given me appointment for extension of my visa. I have sent emails, booked emergency appointment through website, dropped by to talk in person and yet nothing has worked out. I AM LIVING WITH EXPIRED VISA FOR THE PAST 2 MONTHS NOW. CANT travel anywhere. This situation has left me extremely anxious and worried and i am at my wits end. Please please share what can i do in this situation 

Many thanks in advance. ",https://www.reddit.com/r/stuttgart/comments/1mxyyrj/living_with_expired_visa/,7,3,Frage / Advice
1mxueas,1755931762.0,benzostgt,Feuerwerksgeräusche weit weg von flammende Sterne,Hat jemand gestern auch Feuerwerk gehört. Hier in Degerloch zwischen 22:13- ca. 22:17 war das deutlich zu hören. Flammende Sterne in Ostfildern ist ja recht weit weg und dafür war es such sehr kurz. Irgend eine Ahnung was das war?,https://www.reddit.com/r/stuttgart/comments/1mxueas/feuerwerksgeräusche_weit_weg_von_flammende_sterne/,0,2,Frage / Advice
1mxgpqj,1755892674.0,[deleted],Wo in Stuttgart findet man gute Vinyl-Shops?,,https://www.reddit.com/r/stuttgart/comments/1mxgpqj/wo_in_stuttgart_findet_man_gute_vinylshops/,19,14,Frage / Advice
1mxg1a7,1755891080.0,rakka3187,What is a good place downtown for Sauerbraten?,My brother is in town and has a craving. Any recommendations? Preferably downtown. ,https://www.reddit.com/r/stuttgart/comments/1mxg1a7/what_is_a_good_place_downtown_for_sauerbraten/,4,1,Looking for...
1mxbyla,1755881832.0,Godlex,Foodspots gesucht,"Hallo Leute,
ich liebe gutes Essen und habe einen kleinen Foodblog auf Social Media angefangen. Ich teste Restaurants in und um Stuttgart und bewerte sie dann. 

Habt ihr vielleicht ein paar Tipps für mich? Also neben den ganzen Klassikern wie Do Shi Rak, L‘Artista, Kwan Kao usw. 

Danke 🙏 ",https://www.reddit.com/r/stuttgart/comments/1mxbyla/foodspots_gesucht/,0,20,Looking for...
1mx876u,1755873284.0,SmallPresentation325,Starthilfe fürs Auto,Mein Auto steht in Stuttgart-Mitte mit leerer Batterie. ADAC würde 2h brauchen. Ist jemand in der Umgebung und kann mir spontan Starthilfe geben? T_T,https://www.reddit.com/r/stuttgart/comments/1mx876u/starthilfe_fürs_auto/,15,9,Sonstiges
1mx589c,1755865931.0,maherahmedraza1,Zeppelin,,https://www.reddit.com/r/stuttgart/comments/1mx589c/zeppelin/,111,20,Sonstiges
1mx29e0,1755856612.0,Learningto_fly,IKEA Balcony “tiles” scrap,"Hello Everyone,
How can I discard these balcony tiles in Stuttgart ?
Can I put them in the black bin ?

Thank you ",https://www.reddit.com/r/stuttgart/comments/1mx29e0/ikea_balcony_tiles_scrap/,2,3,Frage / Advice
1mwksnn,1755804729.0,[deleted],Can someone lend me a Nikon D3200 Charger for tomorrow,"Hello

I'm travelling in Stuttgart and I forgot the charger for my camera, I'm looking forward to take some cool pictures but unfortunately I'm going to run out of battery. Please, if someone can write me on reddit and lend me the charger at home, in a place I would appreciate it, I can even make a Paypal if necessary. 
Thank you very much and I apologize especially to the one who manages this forum but it is urgent.",https://www.reddit.com/r/stuttgart/comments/1mwksnn/can_someone_lend_me_a_nikon_d3200_charger_for/,6,1,Frage / Advice
1mwjzva,1755802936.0,According_Jump_403,An Fenja,"Moin Fenja,

Wir haben uns heute morgen bei einer Führung durch Prag kennengelernt und haben über den Aussichtsturm geredet. Du sagtest du warst heute morgen da und bist nicht den Turm hoch. Als wir sagten wir wollen da später hoch, meintest du wir sollen Bescheid sagen, ob es geklappt hat. Wir waren oben. Der Ausblick hat sich gelohnt. Das haben wir hiermit getan. Vielen Dank für die Aufmerksamkeit. 

  
Hoffe das hier verstößt gegen keine Regeln. Danke.",https://www.reddit.com/r/stuttgart/comments/1mwjzva/an_fenja/,29,8,Sonstiges
1mwinkg,1755799931.0,hirschhalbe,Pasta von Rummo in Waiblingen oder Fellbach,"Servus, 
Weiß jemand wo man in Waiblingen oder fellbach Nudeln von rummo findet? Gibt's die vor in einem der Kaufländer? 
Tausend dank für jeden tipp",https://www.reddit.com/r/stuttgart/comments/1mwinkg/pasta_von_rummo_in_waiblingen_oder_fellbach/,1,5,Frage / Advice
1mwil2i,1755799775.0,brouhaha13,Picture Frames,"Hello, I'm looking for a fairly large picture frame with standard dimensions (A1) and I was hoping this sub could provide recommendations on where I might find one in the city center. Thanks!",https://www.reddit.com/r/stuttgart/comments/1mwil2i/picture_frames/,3,4,Looking for...
1mwfxoi,1755793938.0,Capital_Tourist_2026,Ich mag S21.,,https://www.reddit.com/r/stuttgart/comments/1mwfxoi/ich_mag_s21/,835,128,Diskussion
1mwdb27,1755788268.0,EarHairy9462,"Welcher Ort in der Stadt wird am meisten unterschätzt, um einen entspannten Sonntag zu verbringen?","
In letzter Zeit versuche ich, aus meiner „immer dieselben drei Orte“-Routine auszubrechen. Ich weiß, diese Stadt hat viel mehr zu bieten, als nur zwischen Cafés, Buchhandlungen und der einen oder anderen Spelunke zu pendeln.
Wohin gehst du also am liebsten, wenn du einfach nur entspannen, Leute beobachten oder neue Energie tanken willst? Bonuspunkte gibt es, wenn es gutes Essen, Live-Musik oder eine gemütliche Atmosphäre gibt.",https://www.reddit.com/r/stuttgart/comments/1mwdb27/welcher_ort_in_der_stadt_wird_am_meisten/,16,17,Diskussion
1mwd1rd,1755787706.0,Relevant_Volume5172,Gutes Ramen Essen?,"Servus,

Der Titel sagt es eigentlich. Ich würde gerne mal frischen guten Ramen probieren und wollte mal fragen ob jemand von euch einen Tipp hat? Google hat mir nicht viel ausgespuckt. 

Danke im Voraus! ",https://www.reddit.com/r/stuttgart/comments/1mwd1rd/gutes_ramen_essen/,11,16,Looking for...
1mw7rkd,1755774119.0,[deleted],Professionelle Zahnreinigung Empfehlungen,"Hallo,

Kennt hier jemand einen gute Anlaufstelle für professionelle Zahnreinigung in Stuttgart (gerne auch im südlichen Umland)?

Mein bisheriger Zahnarzt verrechnet 185€ für ca. 40 Minuten und das erscheint mir sehr teuer.

Danke ",https://www.reddit.com/r/stuttgart/comments/1mw7rkd/professionelle_zahnreinigung_empfehlungen/,4,13,Frage / Advice
1mw55ia,1755764611.0,Beerman9,Kohlensäure für Zapfanlage,"Weiß jemand wo man in/um Stuttgart schnell (heute) eine Gasflasche siehe Bild für eine Bier-Zapfanlage bekommt? :)

Danke!🙏🏻 ",https://www.reddit.com/r/stuttgart/comments/1mw55ia/kohlensäure_für_zapfanlage/,46,15,Looking for...
1mw4xg2,1755763738.0,Electronic_Shine906,participants needed / Paid oppurtunity Sindelfingen,"**Paid Study Participants Wanted – Car testing Sindelfingen (3h, €150)**

Hi everyone,

We are looking for participants to take part in a **3-hour test session at  Sindelfingen**.

* **Compensation:** €150 (one-time, cash or transfer)
* **What you’ll do:** Sit in a car, change seating positions, and follow simple posture instructions. Everything will be recorded for machine learning research.
* **No driving required** – no license needed.
* **Important:** Each person can only participate once.
* **Who we’re looking for:** To balance our dataset, we are currently prioritizing participants from ethnic backgrounds **other than South Asian** (since we already have sufficient data in that group). You must be Above 18 or join with guardians

If you’re interested, please contact me via **Reddit DM** for more details.

Thanks!",https://www.reddit.com/r/stuttgart/comments/1mw4xg2/participants_needed_paid_oppurtunity_sindelfingen/,0,6,Looking for...
1mvuauw,1755730966.0,Determined_Turtle,Good Place to Repair Cracked Samsung Galaxy Screen?,"Hey Everyone, just what the title says. Can anyone recommend a good phone screen repair shop in Stuttgart/Stuttgart area? Specifically, one that can fix Samsung Galaxy S23 Ultra screen?

Thanks!",https://www.reddit.com/r/stuttgart/comments/1mvuauw/good_place_to_repair_cracked_samsung_galaxy_screen/,5,2,Looking for...
1mvtg7s,1755728860.0,nats_cd,Offline places for PC parts?,"Hello zusammen, 

I recently moved here and was wondering where I could purchase parts for my pc?
Is there something like a microcenter here where I could just go and pick up what I wanted? I went to mediamarkt, but it didn’t seem to have solo PC parts. 

I ofcourse know Amazon exists, but I like of idea of shopping offline (I’m a PC enthusiast).

Any help on this would be appreciated. 

Thanks! 
",https://www.reddit.com/r/stuttgart/comments/1mvtg7s/offline_places_for_pc_parts/,5,11,Frage / Advice
1mvlm6a,1755711490.0,abhi263,Dilemma!!,"Hey all,   
I am an international student who just got admitted to HFT Stuttgart. I have applied for rooms in a lot of locations. I had received admission for a room from VSSW (Allmandring area) earlier. I have accepted and paid the deposit there. But recently, I received an additional offer from Studierendenwerk Stuttgart. I'm kind of in a dilemma. On the one hand, I have confirmed the one from VSSW and already paid the deposit. On the other hand, I'm curious as to whether the one from Studierendenwerk Stuttgart is better than the rooms from VSSW. For some further context, the rents are comparable. I want to know whether Studierendenwerk Stuttgart offers better rooms compared to VSSW. Also, is it a big hassle for me to turn back on VSSW if I have to? If you guys have any advice or can provide any help, it would be awesome!!! Also, please let me know if any further explanation is needed. Thanks in advance.",https://www.reddit.com/r/stuttgart/comments/1mvlm6a/dilemma/,3,2,Frage / Advice
1mvlbl2,1755710864.0,FlatSir5854,"Hi, After you applied for a Blue card with ABH, how long does it take to arrive ?? And is it easy to get an appointment to collect it ??",,https://www.reddit.com/r/stuttgart/comments/1mvlbl2/hi_after_you_applied_for_a_blue_card_with_abh_how/,1,1,Frage / Advice
1mvitgs,1755705533.0,Living_questions,Looking for Tamil sangam whatsapp group,"Hello, I am an upcoming student moving to Stuttgart. I am looking for accommodation and to connect with fellow students..so if anyone have any useful groups or information about the whatsapp groups kindly DM me. It would be of greatest help",https://www.reddit.com/r/stuttgart/comments/1mvitgs/looking_for_tamil_sangam_whatsapp_group/,0,0,Looking for...
1mvadnx,1755683414.0,ipreferwine456,What a hard question!,,https://www.reddit.com/r/stuttgart/comments/1mvadnx/what_a_hard_question/,216,7,Sonstiges
