id,created_utc,author,title,selftext,permalink,score,num_comments,flair_text
1m18unm,1752660967.0,RedJames17,Badminton mit Hansefit Oder Welllpass,"Hello Everyone, 

My friends and I play badminton regularly and mostly twice a week. We all have different passes from our Arbeitgeber and wanted to know if there are any studios that give a discount or include badminton in the above mentioned passes in Stuttgart. 

The website and studios list doesn’t mention what is included unfortunately. All of them have a badminton logo but the ones we visited didn’t let us use our pass and said it’s only for the gym. 

Looking forward to your responses. Thank you! ",https://www.reddit.com/r/stuttgart/comments/1m18unm/badminton_mit_hansefit_oder_welllpass/,2,2,Looking for...
1m0ycve,1752625166.0,HercDrvrWo,Group viewing Perseids Meterors?,"Hi, American here in town for business, looking for my partner and I to view the Perseids Meteor shower on the 29th or 30th in the Stuttgart area. Looking for a group or place to view in the area.

Any help would be greatly appreciated!",https://www.reddit.com/r/stuttgart/comments/1m0ycve/group_viewing_perseids_meterors/,5,2,Looking for...
1m0vdbe,1752617317.0,airbooker,E-Piano Spenden - Wohin?,"Ich hab ein E-Piano was ich nicht mehr brauche. Bevor ich mir den Stress mit Kleinanzeigen gebe, würde ich gerne schauen ob ich das irgendwo unkompliziert für einen guten Zweck spenden kann. Das Piano (Yamaha P105) ist jetzt nichts für anspruchsvolle Musiker, sondern eher ein Anfängermodell. Hat jemand eine Idee wo ich da anfragen könnte? Vermitteln Musikschulen eventuell so was an Schüler die es sich sonst nicht leisten könnten? Leider ist Versand wegen fehlender Originalverpackung umständlich, daher würde ich was lokales bevorzugen.",https://www.reddit.com/r/stuttgart/comments/1m0vdbe/epiano_spenden_wohin/,12,7,Looking for...
1m0p51j,1752602976.0,OkZookeepergame9671,"Wer geht noch alles zum CSD Stuttgart oder zum Studio Gaga Pride Festival? Lust, sich vorher zu connecten oder zusammen hinzugehen?","Hey zusammen!  
Ich (m28, schwul) hatte den Beitrag schon mal in einem anderen Thread gepostet – in der Hoffnung, dass sich vielleicht eine kleine Gruppe zusammenfindet, auch gerne mit Leuten von außerhalb. Leider kam da bisher nicht so viel Rückmeldung. 

Deshalb probier ich’s jetzt mal hier.  
Ich bin erst vor kurzem nach Stuttgart gezogen, kenne schon ein paar Leute, hätte aber mega Bock, noch mehr coole Menschen kennenzulernen – egal ob aus Stuttgart selbst oder von außerhalb, die für den CSD herkommen.

Wer von euch ist beim Stuttgarter CSD oder beim Studio Gaga Pride Festival dabei und hätte Lust, sich vorher ein bisschen zu vernetzen oder vielleicht sogar gemeinsam hinzugehen?

Fände es richtig schön, wenn man vielleicht einen gemeinsamen Treffpunkt und eine Uhrzeit für die Demo ausmachen könnte – und wer danach noch feiern mag, könnte man dann zusammen als Gruppe ins Studio Gaga weiterziehen. 

Freu mich, wenn sich jemand meldet!

https://preview.redd.it/bpy04v6ew2df1.jpg?width=1080&format=pjpg&auto=webp&s=a0452a8988631cb2368a51250359a810c1c39c64

",https://www.reddit.com/r/stuttgart/comments/1m0p51j/wer_geht_noch_alles_zum_csd_stuttgart_oder_zum/,23,1,Events
1m0n1uj,1752598345.0,ipreferwine456,Just why?,"Beer coasters are dirty AF, and yet, people put them on the glass. And they drink from that glass!

Unbelievable.",https://www.reddit.com/r/stuttgart/comments/1m0n1uj/just_why/,0,8,Frage / Advice
1m0mlia,1752597332.0,Evethefief,"Whats up with the ""1000 Ratten""?","When you take the U15 past Bubenbad you can see several buildings where someone Sprayed ""1000 Ratten"". Does anyone know why or if it means anything?",https://www.reddit.com/r/stuttgart/comments/1m0mlia/whats_up_with_the_1000_ratten/,14,5,Frage / Advice
1m0f8xr,1752578829.0,Radon-,City Döner Ostendstr zu?,War heute da und Fenster zugeklebt. Logo war auch überklebt. Weiß da jemand genaueres? Nur Renovierung oder dauerhaft zu?,https://www.reddit.com/r/stuttgart/comments/1m0f8xr/city_döner_ostendstr_zu/,5,7,Frage / Advice
1m0f3ml,1752578344.0,CaptainParger,Where to find a mala?,"Dear indian, hindu, tibetian, buddhist, thai and other folks,

any idea where to find a mala around Stuttgart??

A mala is a prayer chain mostly used in Buddhism and Hinduism for mantras. It's similar to a catholic Rosenkranz.

Thanks for your help!

Edit: I just saw that The Markt der Kulturen just started today! I am sure I will find one there. If you don't know yet I highly recommend visiting it until Sunday. There is plenty yummy food, music and art from all over the world! :)",https://www.reddit.com/r/stuttgart/comments/1m0f3ml/where_to_find_a_mala/,0,4,Frage / Advice
1m0dl9w,1752573079.0,ipreferwine456,"Thank heavens, the scaffolding is gone!","Gonna celebrate today, see you in Alte Schule after five.",https://www.reddit.com/r/stuttgart/comments/1m0dl9w/thank_heavens_the_scaffolding_is_gone/,75,3,News
1m0d83l,1752571702.0,life_s_magical,Stuck with a coupon,"can someone suggest ways to get rid of (sell) a coupon that i got from uni flucht as refund for a trip i couldnt  go to. i already posted in ebay. if there is any other ideas, platforms to sell this i would really apprecitate the help. i could really use the money right now

",https://www.reddit.com/r/stuttgart/comments/1m0d83l/stuck_with_a_coupon/,3,2,Frage / Advice
1m001k3,1752530622.0,Salt-Maintenance-,Hat schon mal jemand über Check24 einen Herd anschließen lassen?,"Würde mich interessieren, was der aus- und Einbau in Stuttgart ungefähr kostet via check24 Handwerker. Der Einbauservice mancher Anbieter ist teilweise sehr teuer, da könnte ich mir vorstellen dass es so günstiger sein könnte.
Danke!",https://www.reddit.com/r/stuttgart/comments/1m001k3/hat_schon_mal_jemand_über_check24_einen_herd/,1,1,Frage / Advice
1lzvm2f,1752520493.0,Green_Waltz_4269,Lockenfriseur?,"Hi, welchem Friseursalon kann man seine lieben Locken anvertrauen? Hab Angst einfach auf gut Glück irgendwo hinzugehen, ergo bitte um Empfehlungen! ",https://www.reddit.com/r/stuttgart/comments/1lzvm2f/lockenfriseur/,9,1,Looking for...
1lzsior,1752513737.0,Stuggi70439,Vermüllung Sammelplätze,"So wie auf dem Bild sieht es an diesem Platz alle 3-4 Tage nach einer Beseitigung aus. Die anderen Sammelplätze sehen nicht viel besser aus.
Habe mal wieder das Bezirksamt angeschrieben und die Kollegen der Abfallwirtschaft, die räumen das ja meist auch schnell weg. 
Aber wann wird mal endlich etwas gegen diese kriminellen Vereinigungen unternommen?
Die Stadt unternimmt nichts und hat kein nachhaltiges Konzept außer wegräumen. Und eine Antwort bekomme ich mittlerweile auch mehr… 
In der letzten Stadtteilversammlung hier in Stuttgart-Stammheim gab es auch nur Beschwichtigungen seitens der Bürgermeister und der AWS",https://www.reddit.com/r/stuttgart/comments/1lzsior/vermüllung_sammelplätze/,91,96,News
1lzrqab,1752512033.0,ThatYC,Any Recommendations for Alternative/Hiphop clubs?,I’m headed to Stuttgart this summer and I’m looking for any local venues or clubs that offer show local underground artists or bars/clubs that cater to the scene,https://www.reddit.com/r/stuttgart/comments/1lzrqab/any_recommendations_for_alternativehiphop_clubs/,5,1,Looking for...
1lzm0dm,1752498666.0,Anxious-Offer-9564,Uni Hohenheim Master,"Hey zusammen,

ich überlege aktuell, ob ich mich für den 
Master im Management an der Uni Hohenheim bewerben soll, vielleicht kann mir hier jemand aus eigener Erfahrung (oder aus dem Umfeld) etwas dazu sagen.

Kurz zu mir: Ich studiere aktuell an einer Hochschule in Stuttgart und möchte später in den Finance-Bereich gehen (idealerweise Corporate Finance, Unternehmensbewertung, Restrukturierung oder Finanzierung oder sowas), idealerweise im Raum Stuttgart bei einem größeren Unternehmen oder Beratung.

Ich habe schon einige Beiträge auf WiWi-Treff gelesen und dort wird teilweise geschrieben, dass der Master mit Schwerpunkt Financial Management in Hohenheim „ziemlich schwer“ sein soll verglichen mit dem Ruf der Uni. Des Weiteren wurde dort öfter betont, dass ein 2,0 Abschluss absolute Spitze wäre und besser eigentlich fast nicht möglich. 

Das ganze hat mich jetzt etwas irritiert und deshalb meine Fragen an euch:

	•	Wie anspruchsvoll ist der Master wirklich? Ist er mit Disziplin und Interesse gut machbar, oder verbrennt man da? (Mein Ziel wäre so 1,6 oder besser) 
	•	Wie ist der Ruf der Uni Hohenheim im Raum Stuttgart in Richtung Finance / Controlling / Corporate Finance?

Falls jemand konkrete Erfahrungen mit dem Master gemacht hat (oder jemanden kennt), würde ich mich mega über ehrliche Einschätzungen freuen, gerne auch per PN, wenn’s lieber so ist.

Danke euch und liebe Grüße!
",https://www.reddit.com/r/stuttgart/comments/1lzm0dm/uni_hohenheim_master/,7,11,Frage / Advice
1lzl34r,1752496152.0,NotFlxyy,Erstes mal CSD in Stuttgart brauche Tipps :(,"Hey! Ich M22 plane dieses Jahr zum ersten Mal zum CSD zu gehen. Ich mag normalerweise keine Orte mit vielen Menschen und fühl mich da schnell überfordert, aber irgendwas in mir sagt, dass ich trotzdem unbedingt dabei sein will.



Ich hätte auch nichts dagegen, neue Leute kennenzulernen, nur fällt es mir total schwer als introvert  jemanden einfach anzusprechen. Deshalb wollte ich mal fragen, worauf ich achten sollte oder wie ich vielleicht Leute kennenlernen kann, ohne dabei wie ein Creepy Weirdo rüberzukommen.



War vielleicht jemand von euch schon mal allein dort und hat Tipps? Oder geht’s vielleicht jemandem ähnlich?",https://www.reddit.com/r/stuttgart/comments/1lzl34r/erstes_mal_csd_in_stuttgart_brauche_tipps/,14,31,Frage / Advice
1lzjpnt,1752491898.0,Davethefrozen,Cannstatter first time advice,"Hi everyone! First timer in the forum and to Stuttgart but after several years of some friends recommending I've finally decided to make my way to the Volksfest!

I've been doing some research and want to sort things out the beat way I can as it seems most places are obviously getting fully booked already.

I'm 32 from Mexico and come with three swedish friends around 28. I guess I wanted your take on whether:

- There's any significant difference in the mood/vibe of the different tents, and one we should definitely go for?
- We'll arrive early Friday and leave late Monday (3/10 - 6/10) is it a must to book a table on either day (Friday/Saturday)? Or any chance you can actually squeeze into a tent (as mentioned given it all seems booked and we're 4 people)

Other than that any advice would be highly appreciated! Looked for some other threads here but none had exactly what I was looking for.",https://www.reddit.com/r/stuttgart/comments/1lzjpnt/cannstatter_first_time_advice/,6,21,Events
1lzjkya,1752491459.0,Classic-Entry-2121,"Suche Restaurant mit Aussicht, Flair, schwäbischer Küche und gut erreichbar","Guten Tag,  
wir (2 Erwachsene, 2 Kinder, 10+14) kommen Montagabend gegen 17 Uhr in der Nähe des Stuttgarter Flughafens an und suchen ein Restaurant mit Aussicht, Stuttgarter Flair und schwäbischer Küche.  
Das Restaurant sollte mit dem ÖPNV gut erreichbar sein – unser Hotel liegt in der Nähe der U6. 

Vielen Dank vorab für eure Empfehlungen und Geheimtipps! ",https://www.reddit.com/r/stuttgart/comments/1lzjkya/suche_restaurant_mit_aussicht_flair_schwäbischer/,6,7,Frage / Advice
1lzihw8,1752487598.0,Learningto_fly,Notary - Urgent Requirement,"Hi All, I am looking for a notary who can help me notarise a document. Matter is a bit urgent. 
Any references ? Thank you ",https://www.reddit.com/r/stuttgart/comments/1lzihw8/notary_urgent_requirement/,0,9,Looking for...
1lz4y9i,1752443470.0,No-Initiative-2684,Looking to meet new people 🌍,"Hey everyone 👋

I’m a 22 Year old, born in Köln 🇩🇪 and a German national, but I’ve spent most of my life outside Germany. I recently moved near Stuttgart and, to be honest, I don’t really know anyone here yet.

I’m hoping to meet some open-minded, kind people to hang out, explore the city, grab coffee, go for walks, gym, enjoy music, or just vibe and have real conversations. I’d love to connect with people from different backgrounds international or local who are into good energy, chilled plans, or just meeting new people.

My German’s still a work in progress, so if you speak English, that’s a bonus , but I’m happy to learn and practice too.

Not looking for anything specific , just genuine connections and good company. If you’re also new here, or just open to meeting someone cool, feel free to drop a comment or DM ✌️",https://www.reddit.com/r/stuttgart/comments/1lz4y9i/looking_to_meet_new_people/,14,3,Looking for...
1lz4d8i,1752441952.0,Hioh9887,Any indoor courts one can book for volleyball?,"Looking for an indoor court where I could book for organising pick up games, in or around Stuttgart. Thanks in advance for any info!",https://www.reddit.com/r/stuttgart/comments/1lz4d8i/any_indoor_courts_one_can_book_for_volleyball/,3,5,Looking for...
1lz3hie,1752439763.0,Gullible-Ad5192,Hobbygruppen Umkreis Welzheim,"Hey, ich bin m[22] und vor nem Jahr nach Welzheim gezogen. Kennt ihr Hobbygeuppen etc mit Leuten in meinem alter in einem ca 20km Radius um Welzheim? Danke im voraus ",https://www.reddit.com/r/stuttgart/comments/1lz3hie/hobbygruppen_umkreis_welzheim/,1,0,Looking for...
1lz3ftk,1752439647.0,amortisman,Almost a year in Stuttgart and still no friends😭,"
Hi everyone,

I’ve been living in Stuttgart for almost a year now. I moved here from Turkey and while I’m generally happy with life here, I’m really struggling with one thing: making friends!!

It’s been hard to meet people outside of work, and I’d really love to find a sweet girl friend (not romantic, just a friend!) to grab coffee with, chat about life, maybe try new cafes or explore the city a bit together. Someone to laugh with and share stories🥲you know, just those little things that make life warmer.

I’m 25, easy-going, love long walks, deep talks, good coffee, and discovering cozy spots around the city. If you’re also looking for a new friend or just someone to hang out with occasionally, feel free to message me! 🫶",https://www.reddit.com/r/stuttgart/comments/1lz3ftk/almost_a_year_in_stuttgart_and_still_no_friends/,37,66,Frage / Advice
1lyync9,1752428035.0,MissImpossible19,Cat as a pet,"Hello precious,

Could you please advise on how to get a cat in Stuttgart? Are there adoption centers or I have to buy a cat?

Many thanks!! 
",https://www.reddit.com/r/stuttgart/comments/1lyync9/cat_as_a_pet/,1,4,Looking for...
1lyxv9c,1752426129.0,Ner0F0rte,Wizardrunde in Stuttgart,"Guten Tag liebe Gemeinde,

als ich hergezogen bin, war ich Teil einer wöchentlichen Wizardrunde. Wir haben uns abends getroffen in einer angenehmen Bar / Café und einfach etwas gezockt. Leider ging das ganze aufgrund der Pandemie in die Brüche.

Ich würde gerne wieder eine Runde gründen. Hat noch jemand Lust? Ich bin 34, wohne in West bin aber auch gerne in Mitte. Kleine angenehme Lokalitäten kenne ich massenhaft.

Wichtig wäre mir, dass meine Mitspieler vielleicht +-7 Jahre sind und dass man mir bitte nur schreibt, wenn man wirklich kommen möchte 😅 hatte hier schon ein paar Kollegen, die kurz schreiben und dann sich nicht mehr melden.

Ich bin auch offen gegenüber anderen Kartenspielen übrigens solange es kein Sammelkartenspiel ist.

Liebe Grüße 👋🏻

English speakers are welcome ☺️",https://www.reddit.com/r/stuttgart/comments/1lyxv9c/wizardrunde_in_stuttgart/,25,12,Looking for...
1lyv5uq,1752419470.0,Objective-Matter-895,Jazz Open 2025 Livestream?,"Hallo,

vielleicht weiß das hier ja jemand: Gibt es die Jazz Open irgendwo online im Livestream zu sehen? Ich meine mich zu errineren, dass das letztes Jahr so war. Ist das dieses Jahr wieder so?

",https://www.reddit.com/r/stuttgart/comments/1lyv5uq/jazz_open_2025_livestream/,5,2,Events
1lyrc86,1752408888.0,reddit-had-it,Searching for Activity next Friday in Stuttgart,"We are two dudes in their end 20‘s looking for some fun activities 
Could be all kinds of stuff (noting sexual, just to be sure) 
Any recommendations? ",https://www.reddit.com/r/stuttgart/comments/1lyrc86/searching_for_activity_next_friday_in_stuttgart/,0,3,Looking for...
1lymzn2,1752392060.0,Standard-Rub-7916,Goths in Stuttgart ?,"Ich bin goth und würde mich übelst über Leute freuen die mit mir auch dementsprechend gekleidet/geschminkt durch Stuttgart laufen würden, da ich aber keine anderen goth Freunde habe wollte ich mal fragen, wo man in stuggi welche kennenlernen kann (mit 17 Jahren).",https://www.reddit.com/r/stuttgart/comments/1lymzn2/goths_in_stuttgart/,19,16,
1lycd2j,1752357724.0,Green_Waltz_4269,Second Hand Stores in Stuttgart?,"Hey, suche schon seit längerem coole alternative Läden in Stuttgart, war schon in manchen, aber irgendwie war nie so der Bringer dabei. Hoffe und bitte um Empfehlungen!! ",https://www.reddit.com/r/stuttgart/comments/1lycd2j/second_hand_stores_in_stuttgart/,5,7,Looking for...
1ly8qxh,1752348148.0,Realistic-Bag-1971,Night drive around stuttgart..,Any recommendations for a night drive short trip around outskirts of Stuttgart? We are group of 4 friends just want to drive and chill.. thanks,https://www.reddit.com/r/stuttgart/comments/1ly8qxh/night_drive_around_stuttgart/,0,13,Frage / Advice
1ly8bvq,1752347099.0,ChemicalFusionnn,Looking for Music jam groups,"Hey guys I play electric guitar, and I used to jam with our group before. I recently moved to Stuttgart and looking for a jam group so I can be involved. Does anyone know any? Would like to hear from you :)",https://www.reddit.com/r/stuttgart/comments/1ly8bvq/looking_for_music_jam_groups/,1,2,Looking for...
1ly6r5t,1752343127.0,Josh_Addy,English speaking church,"Hi everyone,  
I've recently moved to stuttgart and im looking for an english speaking church foor sunday service. If anybody knows anything please share information.",https://www.reddit.com/r/stuttgart/comments/1ly6r5t/english_speaking_church/,0,5,Looking for...
1ly591d,1752339370.0,youssef_nuggets,"Just moved to a small village in Stuttgart, I need some friends I’m kinda lonely","I’m 17 and currently staying in Untermünkheim, a small village near Schwäbisch Hall. I’m here for about another month, just spending part of my summer vacation with my father (he work here). I usually live and study in Tunisia (computer science) but decided to come here for a bit of a change this summer. (i don't speak German)

Thing is… I don’t really know anyone around here I’d really love to meet some new people (maybe around my age) (from Stuttgart or any town near me) just to talk, hang out, or exploring if anyone’s down to chill, grab a coffee, or just talk about random stuff, hit me up!, Even if you just have tips on places to visit or how to meet others around Stuttgart or Schwäbisch Hall, I’d really appreciate it.",https://www.reddit.com/r/stuttgart/comments/1ly591d/just_moved_to_a_small_village_in_stuttgart_i_need/,27,33,Looking for...
1ly516p,1752338809.0,SpecialAgentBurt,Late night bicycle ride: Vaihingen -> Eltingen,"So there’s this impressive imax theater near Eltingen, but the original language screenings are usually at night. I was thinking of riding there by bike and returning at a relatively late hour, around 2–3 am. Do you think it’s possible, and would it be safe to do so? My main concern is riding late at night on the roads between towns.",https://www.reddit.com/r/stuttgart/comments/1ly516p/late_night_bicycle_ride_vaihingen_eltingen/,2,9,Frage / Advice
1ly3mxa,1752335248.0,FaultierPinata,Badeseen für Hunde?,"Hallo,
wir ziehen demnächst nach Stuttgart und suchen nach einem Badesee in dem auch Hunde erlaubt sind. 

Gegoogelt haben wir natürlich schon, der nächste offizielle Hundestrand wird in Karlsruhe angezeigt. Ist halt ein ganzes Stück weg, deshalb wollte ich hier fragen ob jemand Geheimtipps hat. 

Vielen Dank euch! 
",https://www.reddit.com/r/stuttgart/comments/1ly3mxa/badeseen_für_hunde/,0,24,Looking for...
1lxubqn,1752304424.0,NurseHoy,Thinking of moving from Stuttgart to Berlin – worth it?,"Hey everyone,

I’m currently living and working in Stuttgart, but I’m seriously considering making the move to Berlin next year or in the next 2 years. I’ve been here for a few years now – it’s clean, stable, and the nature around is beautiful. But honestly... I’m craving more energy, more diversity, and a bit of organized chaos 😅

I work as a nurse, so job-wise, I know Berlin has some big hospitals like Charité, and I’m hoping the opportunities there might be broader – maybe even a chance to get into more specialized or academic areas.

But I also hear mixed things about Berlin:

Rents are going up fast

Bureaucracy is a nightmare

It's way more hectic and gritty than Stuttgart


At the same time, I’m drawn to the international scene, the creative vibe, and the sense of freedom people talk about in Berlin. Plus, I wouldn’t mind being around more people who speak English now and then.

So, anyone here made the Stuttgart ➝ Berlin move? Was it worth it for you?

Also:

How’s the work-life balance for nurses in Berlin?

Do you regret leaving Stuttgart?

Any advice on neighborhoods that aren’t crazy expensive but still safe and decently connected?


Appreciate any input: good, bad, or brutally honest!

Danke Ihnen!",https://www.reddit.com/r/stuttgart/comments/1lxubqn/thinking_of_moving_from_stuttgart_to_berlin_worth/,0,14,Frage / Advice
1lxkf5j,1752273102.0,happypanda7799,Zwischenruf Teddy Show,"Hallo, war jemand heute auf der Teddy Show und hat gehört was der Typ immer wieder zwischen gerufen hat?",https://www.reddit.com/r/stuttgart/comments/1lxkf5j/zwischenruf_teddy_show/,9,7,Events
1lxi26t,1752267126.0,Illustrious_Mind6943,Hilfe Sozialer Phobie,Hi ich bin 39 männlich und leide unter Sozialer Phobie. Ich habe bereits eine Therapie aber hatte wenig Möglichkeiten das Gelernte umzusetzen und vor allem zu üben. Ich überlege mir einer Selbsthilfe Gruppe beizutreten. Hat jemand Erfahrungen damit? Welche Möglichkeiten gibt es noch im Raum Stuttgart oder in Esslingen?,https://www.reddit.com/r/stuttgart/comments/1lxi26t/hilfe_sozialer_phobie/,12,8,Frage / Advice
1lxghty,1752263316.0,Pale_Engineering5123,Wanted: Lino Lada Duo Eis,Ich bin gerade im Kroatien Urlaub und jetzt schon körperlich abhängig von Lino Lada Duo Eis. Hat jemand eine Idee wo ich diese Köstlichkeit bei uns in der Nähe kaufen kann? Danke und ein schönes Wochenende:),https://www.reddit.com/r/stuttgart/comments/1lxghty/wanted_lino_lada_duo_eis/,6,7,Looking for...
1lxci8t,1752253868.0,merturi,Hochzeit Kleidung,"Wo kann ich eine gute Hochzeit Kleidung für Männer kaufen? Ich werde nicht heiraten aber werde present in der Hochzeit sein. 

Sorry für mein Deutsch!",https://www.reddit.com/r/stuttgart/comments/1lxci8t/hochzeit_kleidung/,6,13,Looking for...
1lxb7g4,1752250866.0,benjo1000,Calisthenics in Feuerbach,Was ist mit dem Sportplatz bei den Volleyball-Feldern in Feuerbach passiert?,https://www.reddit.com/r/stuttgart/comments/1lxb7g4/calisthenics_in_feuerbach/,28,3,Frage / Advice
1lxa675,1752248475.0,SuperAnalyst5210,[ Removed by Reddit ],[ Removed by Reddit on account of violating the [content policy](/help/contentpolicy). ],https://www.reddit.com/r/stuttgart/comments/1lxa675/removed_by_reddit/,0,4,Frage / Advice
1lx9nuj,1752247288.0,Best_Company_7750,Feinwaagen Nähe Königsstraße,Heyy gibt’s irgendwo in der Nähe von der Königsstraße feinwaagen ,https://www.reddit.com/r/stuttgart/comments/1lx9nuj/feinwaagen_nähe_königsstraße/,0,7,Looking for...
1lx41vo,1752232072.0,FNC-Ultra,Hanns Martin Schleyer und Stuttgart,"Warum ist hier in Stuttgart eine Halle und eine Straße nach einem SS-Untersturmführer benannt?

Ich kenne die ganze Geschichte mit der RAF und möchte nochmal extra darauf hinweisen, dass ich Terrorismus und Mord nicht gutheiße.

Trotzdem erschließt sich mir nicht, warum man etwas nach einem SS-Offizier benennt. Ein kurzer Blick in seinen Wikipedia Artiklel verrät, dass er unter anderem für die „Arisierung“ der tschechischen Wirtschaft und der Beschaffung von Zwangsarbeitern zuständig war. Wie kann eine Stadt auf eine solche Person stolz sein?",https://www.reddit.com/r/stuttgart/comments/1lx41vo/hanns_martin_schleyer_und_stuttgart/,149,105,Diskussion
1lwneol,1752179560.0,nokota84,Wo in Stuttgart spontan schminken lassen (ohne Termin)?,"Ich bin demnächst in Stuttgart und suche eine Möglichkeit, mich spontan schminken zu lassen... also ohne vorher einen Termin buchen zu müssen. Mir geht es um ein professionelles Tages-Makeup.

Mir kommen Läden wie Douglas, Sephora oder Breuninger in den Sinn - hab dort aber noch keine Erfahrungen gemacht.

Freue mich über konkrete Empfehlungen. Danke im Voraus!",https://www.reddit.com/r/stuttgart/comments/1lwneol/wo_in_stuttgart_spontan_schminken_lassen_ohne/,1,7,Frage / Advice
1lweftq,1752158419.0,Local_Tangerine4662,Alarm Stuttgart Vogelsang,"Habt ihr auch die Warndurchsage die aktuell noch circa beim Vogelsang läuft gehört, und könnt mir eventuell sagen, was da durchgesagt wird? Ich kann nur ""Achtung, Achtung, Gefahr"" hier oben am Kräherwald hören. ",https://www.reddit.com/r/stuttgart/comments/1lweftq/alarm_stuttgart_vogelsang/,6,9,Diskussion
