id,created_utc,author,title,selftext,permalink,score,num_comments,flair_text
1oazmol,1760904373.0,Ok-Opportunity5241,Looking to connect with other writers in their 20’s (who write in English),,https://www.reddit.com/r/stuttgart/comments/1oazmol/looking_to_connect_with_other_writers_in_their/,2,0,Looking for...
1oaz3uo,1760903153.0,AvocadoPhone1234,Skaten und Leute kennenlernen,"Heyy Leute!

Ich (m20) hab gestern wieder angefangen zu skaten, seit Corona. Die beiden Sessions fand ich extrem cool und produktiv, hab wieder Ollies hinbekommen (sehen noch eklig aus) und sogar gecheckt wie man Kickflips macht (hab 1 gelandet, bin aber ausgerutscht, aber ich check jtz). Ich bin zwar noch Anfänger, obwohl ich als Kind schon öfter geskatet habe, aber bin jtz sehr sehr motiviert, endlich Fortschritte zu machen und mich weiterzuentwickeln. 

Deshalb möchte ich Leute kennenlernen, die auch skaten, weil ich es bisher immer alleine gemacht habe und fänds geil, bissl zu sozialisieren und nicht nur am Wochenende skaten, wenn ich zuhause statt in der WG bin. 

Gerne schreiben, ich beiße nicht :) 
",https://www.reddit.com/r/stuttgart/comments/1oaz3uo/skaten_und_leute_kennenlernen/,9,3,Looking for...
1oawx1d,1760898057.0,Toxif734,Essens-Date/WICHTIG!,Ich hab ein riesen Problem... ich habe endlich die Chance die Frau auszuführen bei der ich es schon immer wollte... Sie will am liebsten Steak essen gehen. Meine Frage ist welches eurer Meinung nach das beste ist da die Auswahl groß ist und ich nicht falsch machen will... ich wäre für jede hilfe dankbar,https://www.reddit.com/r/stuttgart/comments/1oawx1d/essensdatewichtig/,14,48,Frage / Advice
1oarim8,1760885315.0,SalamanderNorth1430,Kamera Payerstrasse,Jemand ne Ahnung was das ist? ,https://www.reddit.com/r/stuttgart/comments/1oarim8/kamera_payerstrasse/,6,4,Frage / Advice
1oaljsu,1760866999.0,Ok_Industry2997,Schwimmbad und Sauna in Asemwald,"Hat jemand Erfahrung mit dem Schwimmbad und vor allem der Saunaanlage in Asemwald? Es ist laut google sehr günstig, deshalb Frage ich mich ob es sich lohnt (Sauberkeit, Ausstattung, Anzahl der Menschen) oder ob man lieber in eine größere Anlage in der Gegend geht, die aber eben etwas mehr kostet.

",https://www.reddit.com/r/stuttgart/comments/1oaljsu/schwimmbad_und_sauna_in_asemwald/,11,10,Frage / Advice
1oai1d3,1760853523.0,Quiet_Consequence482,Wo findet man Gepäckschließfächer in der Nähe vom Hbf?,"Entschuldigung, mein Deutsch ist nicht so gut",https://www.reddit.com/r/stuttgart/comments/1oai1d3/wo_findet_man_gepäckschließfächer_in_der_nähe_vom/,1,4,Looking for...
1oaav18,1760830579.0,Weak_Contribution290,Church,"Taking a chance here. My dad was born in Stuttgart in 1937 and passed last year. 

I would like to visit key places of his childhood and I am trying to decipher what church this is in front of.  We traveled to Germany/Stuttgart many times to visit relatives and I remember my mom pointing out a church in old Stuttgart saying it was where my dad went when we was younger.

I thought it was the Stiftkirche, but I cannot be sure.  Thought I would take a chance here.

TYIA",https://www.reddit.com/r/stuttgart/comments/1oaav18/church/,37,3,Frage / Advice
1oa7y5d,1760822915.0,Shaqiri-02,Besten Boxing Gyms in Stuttgart / Ludwigsburg?,"Hallo Zusammen, 

ich würde gerne mit Kickboxen anfangen. Könnt ihr ein gutes Boxing Gym empfehlen? Wäre euch da sehr dankbar!

",https://www.reddit.com/r/stuttgart/comments/1oa7y5d/besten_boxing_gyms_in_stuttgart_ludwigsburg/,2,1,Looking for...
1oa78aq,1760821209.0,MaximumBlast,Sandton der U-Bahn,Weiß jemand hier warum es diesen Sandspeicher mit Fenster in der U-Bahn gibt? I,https://www.reddit.com/r/stuttgart/comments/1oa78aq/sandton_der_ubahn/,107,22,Frage / Advice
1o9whxl,1760795791.0,Ok-Author-8439,Moving to another city,Is there anyone here who recently moved to another city because of how slow the Auslanderbehorde in Stuttgart is? How long did it take for Stuttgart to forward your information to you new city so that you can continue processing your residence permit card?,https://www.reddit.com/r/stuttgart/comments/1o9whxl/moving_to_another_city/,0,5,Diskussion
1o9u7xl,1760789803.0,ecth,Wo Altkleider hinbringen?,"Wenn man googlet, landet man auf der Seite von AWS mit so ner interaktiven Karte, wo die Container stehen. Wo ich wohne, ist der Container aber schon lange nicht mehr da.

Ich weiß, dass ab diesem Jahr einige Regelungen geändert wurden. Hat es damit zu tun?

Kommen da nur absolut intakte Klamotten hin und der Rest in den Restmüll? Auch da habe ich gehört, dass Strafen für eigentlich OK Klamotten im Restmüll nun hoch seien?

Wie man merkt, viel Unsicherheit und ich konnte nichts Aktuelles finden. Bitte im Rat.

Sind die anderen Container noch da? Soll ich einfach mal Kleidersäcke ins Auto laden und mehrere Container von der AWS Karte anfahren? Oder direkt zum Wertstoffhof?",https://www.reddit.com/r/stuttgart/comments/1o9u7xl/wo_altkleider_hinbringen/,7,8,Frage / Advice
1o9tz9q,1760789088.0,krekerss,Is there a car meet in Stuttgard today?,"Like the title says. I have a free weekend from Latvia in Stuttgard and was looking for activities in the evening/night could not find any public info so maybe locals can help me? 


Thank you in advance",https://www.reddit.com/r/stuttgart/comments/1o9tz9q/is_there_a_car_meet_in_stuttgard_today/,4,6,Looking for...
1o9tt1f,1760788574.0,fatcapone25,Empire State of mine Stuttgart Version?,"Ja moin,

Es gab vor einigen Jahren mal eine Stuttgart Version von dem Alicia Keys Song. 

Ein Mann hat gerappt und eine junge Dame mit einer wundervollen Stimme die Hook gesungen. Weiss weder Interpreten noch Song Name, googlen brachte leider nichts.

Weiss jemand welchen Track ich meine?

Gruss

",https://www.reddit.com/r/stuttgart/comments/1o9tt1f/empire_state_of_mine_stuttgart_version/,7,2,Frage / Advice
1o9tc81,1760787023.0,ultrahungry,Engelbergtunnel totsl gesperrt,Feuerwehr mit Atemschutz und Polizei ist im Einsatz. ,https://www.reddit.com/r/stuttgart/comments/1o9tc81/engelbergtunnel_totsl_gesperrt/,115,34,News
1o9qlye,1760776892.0,Gorianfleyer,Wo in Stuttgart kann ich Elektronikbastelbedarf kaufen?,"Ich hab vor einiger Zeit mit einer Raspberry Pi Wetterstation angefangen und da ich da noch blutiger Anfänger bin, fehlen mir halt immer wieder Teile.

Ich hab jetzt öfter bei Reichelt bestellt, aber da der mit jeder Bestellung länger zu brauchen scheint und sich die Kartons in meinem Papiermüll stapeln, als wollten sie mich auf meine vollkommene Verschwendungssucht hinweisen, würde ich gerne vor Ort einkaufen, wie das früher beim Conrad ging.

Also es geht hier um GPIO Kabel, Widerstände etc",https://www.reddit.com/r/stuttgart/comments/1o9qlye/wo_in_stuttgart_kann_ich_elektronikbastelbedarf/,21,23,Looking for...
1o9hesj,1760746163.0,never_be_clever,Kennt jemanden hier ein Shop wo man sich Roller (bis 50CCM) leihen kann?,"Ich habe gegoogelt aber nichts gefunden...gibts in Deutschland echt keinen Bedarf dafür??!

PS nein will keinen Elektro ""Roller"" von Stella sondern einen Benziner ;-)",https://www.reddit.com/r/stuttgart/comments/1o9hesj/kennt_jemanden_hier_ein_shop_wo_man_sich_roller/,0,8,Looking for...
1o98xjp,1760725152.0,Josh_Addy,Are there any cat cafes here?,i really want to go n pet n play with some cats. ,https://www.reddit.com/r/stuttgart/comments/1o98xjp/are_there_any_cat_cafes_here/,2,16,Looking for...
1o97o6d,1760722258.0,Generalaverage89,"City of Stuttgart, Germany agrees to plans to remove massive street in front of the main train station and create a pedestrian zone",,https://www.reddit.com/r/stuttgart/comments/1o97o6d/city_of_stuttgart_germany_agrees_to_plans_to/,98,16,News
1o92m7p,1760710830.0,Best_Company_7750,420 freundliche Bars in Stuttgart-Schwäbischhall?,"Heyy wir suchen eine 420 freundliche Bar im Umkreis (Muss nicht direkt in Stuttgart sein)
Junglez kennen wir schon aber andere zu kennen wäre auch sehr schön

Danke euch schon mal im Voraus. :) ",https://www.reddit.com/r/stuttgart/comments/1o92m7p/420_freundliche_bars_in_stuttgartschwäbischhall/,8,7,Looking for...
1o8z1s8,1760701454.0,LB070503,Sindelfingen,"Helloo :)

Ich (w22) ziehe nächstes Jahr berufsbedingt nach Sindelfingen.

Was sind eure Geheimtipps für die Stadt? Ich komme aus einem sehr kleinen Dorf und freue mich demnach über die nahe Anbindung an alles :D

",https://www.reddit.com/r/stuttgart/comments/1o8z1s8/sindelfingen/,8,57,Looking for...
1o8y7av,1760698756.0,Lemonjuice_98,Alleine heute ins Wizemann?,"Ich gehe heute Abend alleine auf das HVOB-Konzert im Wizemann, ich war dort noch nie und generell noch nie alleine auf einem Konzert. Habt ihr Tipps oder Infos zu dem Ort, die man vorher haben sollte? Ich bin zudem noch weiblich und eher klein, fühle mich also auch bisschen unsicher, aber die Location sollte in Ordnung sein, oder? ",https://www.reddit.com/r/stuttgart/comments/1o8y7av/alleine_heute_ins_wizemann/,13,17,Events
1o8y3ai,1760698365.0,InternationalMilk957,Looking for Christian Spiritual groups for Men?,"I have been looking online, but I couldnt find any. 

Im especially interested if its in English",https://www.reddit.com/r/stuttgart/comments/1o8y3ai/looking_for_christian_spiritual_groups_for_men/,0,5,Looking for...
1o8xu99,1760697490.0,LeMan92,"Stuttgart meets ""Silent Hill"" (Playstation 1 Ästhetik)","Für die neue Ausgabe ""Der Stuttgarter Schocker"" habe ich passend zum Heft ein paar Locations aus Stuttgart in einer Silent Hill 1/Titelbildschirm-Ästhetik animieren lassen. Wer auf sowas steht, feel free to watch.",https://www.reddit.com/r/stuttgart/comments/1o8xu99/stuttgart_meets_silent_hill_playstation_1_ästhetik/,37,5,Sonstiges
1o8w28a,1760690798.0,Bigeugen,Empfehlung Stadtteil,"Hallo zusammen,
welchem Stadtteil würdet ihr empfehlen für jemand der neu zuzieht ?
Schnelle Anbindung an die Autobahn ist für mich beruflich erforderlich. 
Ansonsten nicht zu urban, bisschen Grünflächen wären auch nett. Mieten so human wie möglich für eine mind. 3 Zimmer Wohnung ",https://www.reddit.com/r/stuttgart/comments/1o8w28a/empfehlung_stadtteil/,0,35,Frage / Advice
1o8w0mu,1760690625.0,ProfesorBacterio,Blume tritt als Porsche-Chef ab,,https://www.reddit.com/r/stuttgart/comments/1o8w0mu/blume_tritt_als_porschechef_ab/,21,7,News
1o8ulxk,1760685073.0,Inevitable_Wish_6899,IT in Stuttgart,,https://www.reddit.com/r/stuttgart/comments/1o8ulxk/it_in_stuttgart/,0,1,News
1o8sbbv,1760676725.0,LunchNo6690,Wucher am Bahnhof 4 Euro für ne 0.5l Waserflasche,,https://www.reddit.com/r/stuttgart/comments/1o8sbbv/wucher_am_bahnhof_4_euro_für_ne_05l_waserflasche/,218,67,Diskussion
1o8ii93,1760649294.0,Additional_Bar4375,Sichherheitsgefühl in der Innenstadt,"Hallo Zusammen 

Ich fühle mich mittlerweile immer unsicherer wenn ich nachts oder abends in der Innenstadt unterwegs bin. Ich habe das Gefühl dass in den letzten zwei Jahren die Menschen die nachts unterwegs sind sehr viel aggressiver geworden sind, gerade als weibliche Person war es schon immer unsicher vom feiern oder von einer Bar nach Hause zu kommen.  Aber seit zwei Jahren haben die Situationen in denen ich belästigt oder mir etwas hinterher gerufen wurde enorm zu genommen. Vor allem Königstraße Schlossplatz Rotebühlplatz und Arnulf klett Platz meide ich inzwischen. Mich würde interessieren habt ihr auch das Gefühl dass es in der Stuttgarter Innenstadt in den letzten Jahren unsicherer geworden ist oder rede ich mir das ein ? 

P.S. Wenn jetzt hier irgendwer denkt das ganze auf Migranten schieben und rechte hetze
 verbreiten zu müssen lasst es bitte sein. ",https://www.reddit.com/r/stuttgart/comments/1o8ii93/sichherheitsgefühl_in_der_innenstadt/,74,134,Diskussion
1o8h3qx,1760645985.0,Numerous_Teach_8289,Stuttgart neu entdecken,"Hallo zusammen,

da ich aktuell krankgeschrieben bin versuche ich so viel wie möglich an die frische Luft zu kommen um wieder Kraft zu tanken. Hierbei hat es mich vor einigen Tagen zufällig nach Stuttgart getrieben, wo ich an einigen Orten war die ich ewig nicht besucht habe.

Ich bin in Stuttgart geboren und aufgewachsen, mein Aktionsradios hat sich nach der Kindheit aber eigl. nur noch um Mitte, Nord und Cannstatt bewegt, wo ich gefühlt jeden Winkel kenne. Im Rest der Stadt war ich gefühlt nie.

Ich habe gemerkt wie viel Spaß es macht die Stadt wieder neu zu entdecken und Orte zu besuchen, an denen man seit Kindheit nicht mehr war. Leider gehen mir so langsam die (offensichtlichen) Ideen aus was ich tun könnte.

Hat jemand Tipps für mich? Was ich suche sind Geheimtipps, das kann wirklich alles sein, am besten an der frischen Luft und schön im Herbst. Auch gerne eine Gegend, durch die es sich lohnt ziellos zu schlendern, schöne Aussichtspunkte, Stäffele, Wanderrouten etc.
Bin für jeden Vorschlag sehr dankbar!",https://www.reddit.com/r/stuttgart/comments/1o8h3qx/stuttgart_neu_entdecken/,10,11,Looking for...
1o88zm3,1760627984.0,Bubbly-Equipment1323,Ticket für Bluthund abzugeben,"Heute um 19 Uhr (ja etwas spontan) findet ein Konzert von Bluthund Im Wizemann statt.
Ich hätte noch ein Ticket abzugeben, falls jemand Interesse hat 😊",https://www.reddit.com/r/stuttgart/comments/1o88zm3/ticket_für_bluthund_abzugeben/,1,0,Events
1o86glp,1760622063.0,Gray-poupon,"I’m planning to stay in Stuttgart for about a week and would love some local advice. Do you have any recommendations on which areas are good to stay in, or places I should maybe avoid?","A bit about what I’m looking for:
	•	I’m interested in the city life, nice areas to walk around, cafés, and possibly some nightlife.
	•	I like clubs and bars, but I don’t need to stay right next to them.
	•	Easy access to public transport would be great.

Some specific questions:
	1.	Which neighborhoods would you recommend for someone who wants a lively but comfortable base?
	2.	Any areas that are too noisy, sketchy, or just inconvenient?
	3.	Any clubs, bars, or nightlife spots worth checking out?
	4.	Bonus: any nice hotels or apartments you’d personally recommend or warn against?

Danke!",https://www.reddit.com/r/stuttgart/comments/1o86glp/im_planning_to_stay_in_stuttgart_for_about_a_week/,4,5,Looking for...
1o8433n,1760615599.0,0711Markus,Verlegung des City‐Rings beschlossen – Arnulf-Klett-Platz wird autofrei,,https://www.reddit.com/r/stuttgart/comments/1o8433n/verlegung_des_cityrings_beschlossen/,191,41,News
1o815r7,1760605259.0,minci-1,"Wenn Du lieber automatisierst, als Formulare auszufüllen 😅🤓","Hey, 

wo finde ich am besten IT-Köpfe, die Bock auf Automatisierung und KI haben? Gerne auch während des Studium / sonstigen Projekten 

Als Mittelständler wollen wir bei Digitalisierung vorne mitspielen und alles mit smarten Tools / KI / Automatisierungen lösen. 

Ideen wo wir ausschreiben können? PS - gleichermaßen wie Papierkram hassen wir auch Anschreiben und Bewerbungsmappen 😄 und ist die Motivation wichtig und nicht X Stufen im Lebenslauf ",https://www.reddit.com/r/stuttgart/comments/1o815r7/wenn_du_lieber_automatisierst_als_formulare/,0,6,Frage / Advice
1o80o08,1760603254.0,accounting_cunt,Wofür sind die zahlreichen Bauarbeiten rund um den Kernerplatz (Stuttgart Ost) gedacht?,"Rund um den Kernerplatz werden schon seit Wochen Bürgersteige und teilweise Straßen aufgebrochen und Leitungen offen gelegt. Weiß jemand, was hier geplant ist?",https://www.reddit.com/r/stuttgart/comments/1o80o08/wofür_sind_die_zahlreichen_bauarbeiten_rund_um/,4,2,Frage / Advice
1o7zlxi,1760599011.0,dineshvg1023,Looking for Recommendations: Good Kitas in Stuttgart Ost & Mitte — waiting times & fees?,"Hi everyone,

I’m looking for childcare / Kita options in Stuttgart Ost and Stuttgart Mitte. I’m trying to gather info for a few things, and would really appreciate your experience and advice.

Here are some things I’m especially interested in:

1. Which Kitas you would recommend: any Kinder­gärten / Kitas that you found especially good — for example, staff quality, language support (German and/or English), openness to cultural diversity, etc.


2. Waiting period: how long were you on the waiting list? Did you manage to get a spot in a “good” Kita or was it very long?


3. Fees / price: what are you currently paying (monthly or however the fee is structured)? Are there extra costs (meals, language classes, materials, etc.)?


4. Any tips: Is there a certain process/timing you’d recommend (when to apply, which Träger to contact, etc.)?
",https://www.reddit.com/r/stuttgart/comments/1o7zlxi/looking_for_recommendations_good_kitas_in/,2,6,Looking for...
1o7qgb3,1760570287.0,DysfunctionalMedic,Pendler Wohnungen?,,https://www.reddit.com/r/stuttgart/comments/1o7qgb3/pendler_wohnungen/,2,0,Looking for...
1o7onua,1760565803.0,DangerousConflict747,Christmas Market,"Hi. I am looking to travel for Christmas Markets. There is cheap flights to Stuggart , so i was looking at Esslingen. Would you recommend staying in Stuggart and travelling or Esslingen? Or going somewhere else in Germany? 

Thank you? ",https://www.reddit.com/r/stuttgart/comments/1o7onua/christmas_market/,4,13,Looking for...
1o7jfoh,1760553827.0,LeMan92,Der Stuttgarter Schocker - Im Feinstaub des Grauens,"1 Jahr nach ""Das Monster aus der Fritty Bar"" - fühlt sich sehr surreal an, aber nun erscheint schon Teil 4 (plus ein SSB-Exclusive) der Horror-Anthologie aus dem Kessel. Danke an alle aus dem Sub, die die Comics supporten. Ihr seid großartig! 

Link zum Comic-Heft: 

[https://heppy-hour.de/produkt/der-stuttgarter-schocker-nr-4-im-feinstaub-des-grauens/](https://heppy-hour.de/produkt/der-stuttgarter-schocker-nr-4-im-feinstaub-des-grauens/)",https://www.reddit.com/r/stuttgart/comments/1o7jfoh/der_stuttgarter_schocker_im_feinstaub_des_grauens/,28,0,Diskussion
1o7jdx3,1760553718.0,No_Description_4993,Melodic death metal band looking for members!,"I’ve recently moved to Germany and I live near Stuttgart. I’ve been running a band in my homeland and after a meeting that we had they decided that they won’t be able to participate or follow the band to its next steps and we split in good heart and no bad blood.

I am looking for a guitarist,bassist,drummer and maybe a keyboardist,so pretty much everyone. We already have released a bit of music and I have an album ready to go, I can share it with anyone interested to see if it fits their taste. If you like bands such as children of bodom,wintersun,ensiferum,dissection etc. ,then I am sure you’re gonna love it ! 

Peace 🤘🏼",https://www.reddit.com/r/stuttgart/comments/1o7jdx3/melodic_death_metal_band_looking_for_members/,11,0,Looking for...
1o7j4ii,1760553130.0,Foo717721,Plasma spenden,"Hallo zusammen,

Bekommt man für das Plasma spenden Geld ? Wenn ja, wo?
Habt ihr Erfahrungen gemacht ?
 Viele Grüße?",https://www.reddit.com/r/stuttgart/comments/1o7j4ii/plasma_spenden/,3,3,Frage / Advice
1o7fdhs,1760544820.0,Jet_the_fem_bean,Hobbits gegen Palantir!,,https://www.reddit.com/r/stuttgart/comments/1o7fdhs/hobbits_gegen_palantir/,232,44,News
1o7eefq,1760542652.0,EarHairy9462,"Just Moved to Stuttgart, Hoping to Meet Like-Minded People","
Hi everyone 👋

I recently moved to Stuttgart about a month ago and I’m looking to meet new people and hopefully make some friends here. I’ve tried Meetup, Spontacts, and a few other platforms, but so far I haven’t really found like-minded people.

A little about me: I enjoy reading, watching TV shows and movies, camping, road trips, gardening, meditating, cooking, and traveling. 🌍🌱📚

If anyone shares similar interests and would like to connect, I’d be happy to start with a little chat here first to get comfortable, and then maybe meet up in person.

Looking forward to hearing from you! 🙂",https://www.reddit.com/r/stuttgart/comments/1o7eefq/just_moved_to_stuttgart_hoping_to_meet_likeminded/,23,4,Looking for...
1o76mud,1760521627.0,accounting_cunt,Nehmt ihr an der Auftaktveranstaltung Öffentlichkeitsbeteiligung für die B14 im Stadt Palais teil?,"Als Anwohner der B14 Etappe, die umgestaltet werden soll, bin ich gespannt, wie die aktuellen Pläne aussehen. Trotz PKW denke ich, dass Verkehrsberuhigung und Begrünung der B14 und das Umlegen des City Rings vom Bahnhofvorplatz auf die Wolframstraße die Stadt deutlich lebenswerter und attraktiver machen werden.  


Was denkt ihr zu den aktuellen Plänen?",https://www.reddit.com/r/stuttgart/comments/1o76mud/nehmt_ihr_an_der_auftaktveranstaltung/,29,11,Diskussion
1o75m34,1760517640.0,Reasonable-Win-4135,Halloween Events (no club),"Gibts in Stuttgart irgendwelche Events, die außerhalb von Clubs stattfinden? Maybe etwas ruhiger in ner Bar oder so. Finde über Google nur Club-Partys.

  
Danke im voraus 👋🏻

  
",https://www.reddit.com/r/stuttgart/comments/1o75m34/halloween_events_no_club/,15,0,Events
1o74qf0,1760514124.0,johoham,Hundefreundliches Café,"Gibts an der Ecke oder in der Nähe vom Lindenmuseum ein Café oder Restaurant, in dem Hunde erlaubt sind? ",https://www.reddit.com/r/stuttgart/comments/1o74qf0/hundefreundliches_café/,4,5,Looking for...
1o6yxq9,1760494578.0,BranchElectronic154,Wann wird Stuttgart 21 jetzt eigentlich fertig?,,https://www.reddit.com/r/stuttgart/comments/1o6yxq9/wann_wird_stuttgart_21_jetzt_eigentlich_fertig/,26,58,Frage / Advice
1o6qlga,1760473294.0,jorangery,Jam-sessions / gemeinsam Singen 🫨?,"Hello

Vermisse das wie in der Schule gemeinsam zu singen oder so low-key Musik zu machen (oder evtl auch high-key, ich hätte bock. Aber bin kein professioneller Musiker). Oder auch so auf Hostel-Dachterasse-Wonderwall-Basis, mir echt egal ich feier sowas.

Gibt's da irgendwelche Treffen/Communities/Angebote in der Gegend?
GaLiGrü <3",https://www.reddit.com/r/stuttgart/comments/1o6qlga/jamsessions_gemeinsam_singen/,0,1,Frage / Advice
1o6q8wa,1760472510.0,dineshvg1023,"Shouted at for being ""brown"" near Olgaeck last night. Feeling shaken.","I had a really unsettling thing happen to me yesterday evening and I'm still a bit shaken by it. I was waiting for a friend around 8 pm near Olgaeck, just standing behind the Edeka on my phone.

Out of nowhere, an old German guy (I'd guess in his 50s) came out from one of the apartment buildings and started aggressively yelling at me. The first thing he said was, ""Brown people aren't allowed to stand here."" He then continued to shout a stream of racial slurs.

I was so taken aback that I just froze. I didn't say anything back, and he eventually went back inside. The whole thing was so blatant and hateful.

I'm wondering if this is a known issue in that spot? Or if anyone has had a run-in with this particular individual? It would be helpful to know if this is a pattern or an isolated incident.

Stay safe out there.",https://www.reddit.com/r/stuttgart/comments/1o6q8wa/shouted_at_for_being_brown_near_olgaeck_last/,67,43,Frage / Advice
1o6ot4g,1760469307.0,UnicornRental,"Bester (""Steak"")-Döner östlich von Stuttgart?","Die vielen Restaurant- und Döner-Diskussionen lassen mich hoffen...

Gesucht wird ein guter Dönerladen östlich von Stuttgart (= Remstal rauf bis Schorndorf), der gute Döner mit richtigem Fleisch anbietet.

Alaturka ist zu tief in Stuttgart drin und vor allem reicht mir P/L bei der Kinderportion nicht.  
Dilgelay ist aktuell meine Alternative - aber auch hier müsste ich für einen Döner extra nach Stuttgart rein.

Was gibts sonst noch?  
Besten Dank!",https://www.reddit.com/r/stuttgart/comments/1o6ot4g/bester_steakdöner_östlich_von_stuttgart/,1,4,Looking for...
1o6muo0,1760464910.0,maw32,Stadtbahnen blockieren Kreuzungen,"Mir ist in den letzten Wochen aufgefallen, dass Stadtbahnen auf Kreuzungen stehen bleiben wenn sie eine entgegenkommende Bahn sehen, welche die Ampelphase nicht mehr schaffen würde, und erst weiterfahren wenn die entgegenkommende Bahn auf der Kreuzung ist.

Ich konnte noch nicht im Detail beobachten, ob die entgegenkommende Bahn dann bei Halt zeigender Ampel fährt oder ob die erste Bahn durch das Blockieren des Gleises eine längere Ampelphase erzwingt.

Am häufigsten passiert das am Wilhelmsplatz Richtung Fellbach und wenn die U13 zwischen Uff-Kirchhof und Ebitzweg abbiegt. Seltener zwischen Wilhelmsplatz und Uff-Kirchhof an der Kreuzung Waiblinger Str./Daimlerstr. und am Fußgängerübergang bei der Kreuznacher Str.. Einmal habe ich es bei der Haltestelle Stöckach gesehen.

Ist das erst seit kurzem so oder ist mir das nur nie aufgefallen?",https://www.reddit.com/r/stuttgart/comments/1o6muo0/stadtbahnen_blockieren_kreuzungen/,15,9,Frage / Advice
1o6mm40,1760464416.0,backwarenverkaeufer,Ich suche ein klassisch schwäbisches Restaurant,"Ende November verbringe ich mit meiner Familie – 6 Erwachsene und 3 Kinder (3, 2 und 1 Jahr alt) – ein Wochenende in Stuttgart.
Nun sind wir auf der Suche nach einem guten Restaurant.
Habt ihr einen konkreten Vorschlag oder einen Favoriten, den ihr gerne teilen möchtet?",https://www.reddit.com/r/stuttgart/comments/1o6mm40/ich_suche_ein_klassisch_schwäbisches_restaurant/,17,42,Looking for...
1o6k6fw,1760459113.0,jorangery,Beste vegetarische Ramen Stuttgart?,"Hab nur ultra alte Posts gefunden, wollte mal einen neuen Laden ausprobieren. War bisher irgendwie immer nur in Rotation bei Umami, Famosa, TangBa, Yangguofu.
Könnt ihr was empfehlen was evlt mehr als nur eine Sorte Ramen ohne Fleisch hat oder auch nur eine die dafür aber besonders gut ist?",https://www.reddit.com/r/stuttgart/comments/1o6k6fw/beste_vegetarische_ramen_stuttgart/,5,12,Frage / Advice
